{"admission":"spec-only","atlasRefs":[{"id":"workstation-basic-v2-atlas","version":1}],"catalogId":"office-assets-v2","catalogVersion":1,"entries":[{"admission":"spec-only","atlasRef":{"id":"workstation-basic-v2-atlas","version":1},"entryId":"workstation-basic-mask-0","familyRef":{"id":"workstation-basic","version":2},"frameRef":{"id":"mask-0","version":1},"geometryRef":{"id":"workstation-geometry","version":1},"lifecycleGroup":"workstations","runtimePath":"office-v2/runtime/workstation-basic/v2/mask-0.png","sha256":"f2711982ca9f070ae61cba276d76782aecb9ffa007af30ec84a61204b45c2282","variantId":"isolated"},{"admission":"spec-only","atlasRef":{"id":"workstation-basic-v2-atlas","version":1},"entryId":"workstation-basic-mask-10","familyRef":{"id":"workstation-basic","version":2},"frameRef":{"id":"mask-10","version":1},"geometryRef":{"id":"workstation-geometry","version":1},"lifecycleGroup":"workstations","runtimePath":"office-v2/runtime/workstation-basic/v2/mask-10.png","sha256":"db5e8b4ca4dec7c8a1bcd165838e8bf948d08407b43fd688470ee0662964936d","variantId":"middle"},{"admission":"spec-only","atlasRef":{"id":"workstation-basic-v2-atlas","version":1},"entryId":"workstation-basic-mask-2","familyRef":{"id":"workstation-basic","version":2},"frameRef":{"id":"mask-2","version":1},"geometryRef":{"id":"workstation-geometry","version":1},"lifecycleGroup":"workstations","runtimePath":"office-v2/runtime/workstation-basic/v2/mask-2.png","sha256":"ab048718e726f45839a40d6fe09e1ce2a0d5f0ac10271ddbeccde1baf87000f5","variantId":"east-end"},{"admission":"spec-only","atlasRef":{"id":"workstation-basic-v2-atlas","version":1},"entryId":"workstation-basic-mask-8","familyRef":{"id":"workstation-basic","version":2},"frameRef":{"id":"mask-8","version":1},"geometryRef":{"id":"workstation-geometry","version":1},"lifecycleGroup":"workstations","runtimePath":"office-v2/runtime/workstation-basic/v2/mask-8.png","sha256":"2a4ccf4c5c29342eabbfd6d517d353ff214e933bc91b052cd3d5049be23382e4","variantId":"west-end"}],"missingAssetPolicy":"fail-closed","schemaVersion":"office-asset-catalog-v1"}