{"admission":"spec-only","atlasRefs":[{"id":"workstation-basic-v3-atlas","version":1}],"catalogId":"office-assets-v3","catalogVersion":1,"entries":[{"admission":"spec-only","atlasRef":{"id":"workstation-basic-v3-atlas","version":1},"entryId":"workstation-basic-mask-0","familyRef":{"id":"workstation-basic","version":3},"frameRef":{"id":"mask-0","version":1},"geometryRef":{"id":"workstation-geometry","version":1},"lifecycleGroup":"workstations","runtimePath":"office-v2/runtime/workstation-basic/v3/mask-0.png","sha256":"eee47716e9ae56f258a05d74660feed0b75c8ce5f0f5be72ca02ec12af6c9326","variantId":"isolated"},{"admission":"spec-only","atlasRef":{"id":"workstation-basic-v3-atlas","version":1},"entryId":"workstation-basic-mask-10","familyRef":{"id":"workstation-basic","version":3},"frameRef":{"id":"mask-10","version":1},"geometryRef":{"id":"workstation-geometry","version":1},"lifecycleGroup":"workstations","runtimePath":"office-v2/runtime/workstation-basic/v3/mask-10.png","sha256":"44470c1252ba459fffc80239e0b549636bc2a02685cc5cef02f85e762eb106a0","variantId":"middle"},{"admission":"spec-only","atlasRef":{"id":"workstation-basic-v3-atlas","version":1},"entryId":"workstation-basic-mask-2","familyRef":{"id":"workstation-basic","version":3},"frameRef":{"id":"mask-2","version":1},"geometryRef":{"id":"workstation-geometry","version":1},"lifecycleGroup":"workstations","runtimePath":"office-v2/runtime/workstation-basic/v3/mask-2.png","sha256":"17537d7fe5724da32d666d29635f17ee2e89c58c381d57b4f61dfc764e30151f","variantId":"east-end"},{"admission":"spec-only","atlasRef":{"id":"workstation-basic-v3-atlas","version":1},"entryId":"workstation-basic-mask-8","familyRef":{"id":"workstation-basic","version":3},"frameRef":{"id":"mask-8","version":1},"geometryRef":{"id":"workstation-geometry","version":1},"lifecycleGroup":"workstations","runtimePath":"office-v2/runtime/workstation-basic/v3/mask-8.png","sha256":"6ae08721570e0652e5b9151837f6b77be51c53e768bddb6e37d07b6a40c91d5e","variantId":"west-end"}],"missingAssetPolicy":"fail-closed","schemaVersion":"office-asset-catalog-v1"}